{
  "patch_id": "p_ef02fcbe",
  "finding_id": "f_YsmRj3Og_ent",
  "workflow_id": "YsmRj3OgBSjVBv0o",
  "strategy": "rule_switch",
  "diff_summary": "Noeud 'Classify ticket' remplace par un Switch a 4 regles + fallback gpt-5-mini",
  "coverage_estimate": 0.96,
  "patched_workflow": {
    "name": "Support ticket triage - patched by Deadweight",
    "nodes": [
      {
        "parameters": {
          "httpMethod": "POST",
          "path": "triage-original",
          "options": {}
        },
        "id": "b0000000-0000-4000-8000-000000000001",
        "name": "Webhook",
        "type": "n8n-nodes-base.webhook",
        "typeVersion": 2,
        "position": [
          0,
          0
        ],
        "webhookId": "b0000000-0000-4000-8000-000000000001"
      },
      {
        "parameters": {
          "options": {}
        },
        "id": "b0000000-0000-4000-8000-000000000004",
        "name": "Route to queue",
        "type": "n8n-nodes-base.set",
        "typeVersion": 3.4,
        "position": [
          528,
          0
        ]
      },
      {
        "parameters": {
          "rules": {
            "values": [
              {
                "conditions": {
                  "options": {
                    "caseSensitive": false,
                    "version": 2
                  },
                  "conditions": [
                    {
                      "leftValue": "={{ $json.body.text }}",
                      "rightValue": "facture|remboursement|paiement a echoue|prelevement|abonnement|debite deux fois|formule de paiement",
                      "operator": {
                        "type": "string",
                        "operation": "regex"
                      }
                    }
                  ],
                  "combinator": "and"
                },
                "outputKey": "billing"
              },
              {
                "conditions": {
                  "options": {
                    "caseSensitive": false,
                    "version": 2
                  },
                  "conditions": [
                    {
                      "leftValue": "={{ $json.body.text }}",
                      "rightValue": "d'export|page export|erreur|page reste blanche|site est tres lent|mise a jour|double authentification|synchronisent|bug|upload de fichier|echoue systematiquement|connexion",
                      "operator": {
                        "type": "string",
                        "operation": "regex"
                      }
                    }
                  ],
                  "combinator": "and"
                },
                "outputKey": "technical"
              },
              {
                "conditions": {
                  "options": {
                    "caseSensitive": false,
                    "version": 2
                  },
                  "conditions": [
                    {
                      "leftValue": "={{ $json.body.text }}",
                      "rightValue": "email de confirmation|propriete du compte|compte semble bloque|supprimer mon compte|ajouter un collegue|mon espace|reinitialiser mon mot de passe|mot de passe",
                      "operator": {
                        "type": "string",
                        "operation": "regex"
                      }
                    }
                  ],
                  "combinator": "and"
                },
                "outputKey": "account"
              },
              {
                "conditions": {
                  "options": {
                    "caseSensitive": false,
                    "version": 2
                  },
                  "conditions": [
                    {
                      "leftValue": "={{ $json.body.text }}",
                      "rightValue": "version mobile|documentation|feliciter|double authentification",
                      "operator": {
                        "type": "string",
                        "operation": "regex"
                      }
                    }
                  ],
                  "combinator": "and"
                },
                "outputKey": "other"
              }
            ]
          },
          "options": {
            "fallbackOutput": "extra",
            "renameFallbackOutput": "unmatched"
          }
        },
        "id": "bd37901d-fb65-42c8-83ca-4c0404870b67",
        "name": "Classify ticket (rules)",
        "type": "n8n-nodes-base.switch",
        "typeVersion": 3.2,
        "position": [
          240,
          0
        ]
      },
      {
        "parameters": {
          "promptType": "define",
          "text": "=Classe ce texte dans exactement une categorie parmi billing, technical, account, other. Reponds uniquement par le mot.\n\nTexte: {{ $json.body.text }}"
        },
        "id": "8fe80bce-8c61-4100-94e8-a6e0b3ab7a6c",
        "name": "Classify ticket fallback (gpt-5-mini)",
        "type": "@n8n/n8n-nodes-langchain.chainLlm",
        "typeVersion": 1.4,
        "position": [
          480,
          200
        ]
      },
      {
        "parameters": {
          "model": "gpt-5-mini",
          "options": {}
        },
        "id": "0228fd4e-0eb5-4986-a3cf-a7520ab55b01",
        "name": "OpenAI Chat Model (gpt-5-mini)",
        "type": "@n8n/n8n-nodes-langchain.lmChatOpenAi",
        "typeVersion": 1.2,
        "position": [
          440,
          400
        ]
      }
    ],
    "connections": {
      "Webhook": {
        "main": [
          [
            {
              "node": "Classify ticket (rules)",
              "type": "main",
              "index": 0
            }
          ]
        ]
      },
      "Classify ticket (rules)": {
        "main": [
          [
            {
              "node": "Route to queue",
              "type": "main",
              "index": 0
            }
          ],
          [
            {
              "node": "Route to queue",
              "type": "main",
              "index": 0
            }
          ],
          [
            {
              "node": "Route to queue",
              "type": "main",
              "index": 0
            }
          ],
          [
            {
              "node": "Route to queue",
              "type": "main",
              "index": 0
            }
          ],
          [
            {
              "node": "Classify ticket fallback (gpt-5-mini)",
              "type": "main",
              "index": 0
            }
          ]
        ]
      },
      "Classify ticket fallback (gpt-5-mini)": {
        "main": [
          [
            {
              "node": "Route to queue",
              "type": "main",
              "index": 0
            }
          ]
        ]
      },
      "OpenAI Chat Model (gpt-5-mini)": {
        "ai_languageModel": [
          [
            {
              "node": "Classify ticket fallback (gpt-5-mini)",
              "type": "ai_languageModel",
              "index": 0
            }
          ]
        ]
      }
    },
    "settings": {
      "executionOrder": "v1"
    }
  }
}